{"$defs":{"artifactReference":{"additionalProperties":false,"properties":{"coordinate":{"minLength":1,"type":"string"},"digest":{"$ref":"#/$defs/digest"}},"required":["coordinate","digest"],"type":"object"},"digest":{"pattern":"^sha256:[0-9a-f]{64}$","type":"string"},"generator":{"additionalProperties":false,"properties":{"coordinate":{"minLength":1,"type":"string"},"digest":{"$ref":"#/$defs/digest"},"version":{"minLength":1,"type":"string"}},"required":["coordinate","version","digest"],"type":"object"}},"$id":"https://wesley.dev/schemas/wesley-generation-provenance-manifest-v1.schema.json","$schema":"https://json-schema.org/draft/2020-12/schema","additionalProperties":false,"properties":{"apiVersion":{"const":"wesley.generation-provenance-manifest/v1"},"contractVersions":{"additionalProperties":false,"properties":{"generatorAbi":{"const":"wesley.extension-generator/v1"},"inputSchema":{"const":"wesley.extension-generation-input/v1"},"provenanceSchema":{"const":"wesley.generation-provenance-manifest/v1"}},"required":["inputSchema","provenanceSchema","generatorAbi"],"type":"object"},"emittedArtifacts":{"items":{"$ref":"#/$defs/artifactReference"},"type":"array"},"generationInputDigest":{"$ref":"#/$defs/digest"},"generator":{"$ref":"#/$defs/generator"},"settingsDigest":{"$ref":"#/$defs/digest"},"sourceArtifacts":{"items":{"$ref":"#/$defs/artifactReference"},"type":"array"}},"required":["apiVersion","generator","generationInputDigest","settingsDigest","contractVersions","sourceArtifacts","emittedArtifacts"],"title":"Wesley Generation Provenance Manifest v1","type":"object"}
