{"apiVersion":"wesley.generation-provenance-manifest/v1","contractVersions":{"generatorAbi":"wesley.extension-generator/v1","inputSchema":"wesley.extension-generation-input/v1","provenanceSchema":"wesley.generation-provenance-manifest/v1"},"emittedArtifacts":[{"coordinate":"fixture:generated-profile@1","digest":"sha256:702f5bb0c6d4fbeba4d44b1eab6317a827a915c6e28398ae7742a229592c7899"}],"generationInputDigest":"sha256:41a870386b59c9bb67658e2a30d964f7a5788eb507a787105d53e1d895c8c4f6","generator":{"coordinate":"fixture:semantic-generator@1","digest":"sha256:ed1c605dc5769e8bf31d0e4cf62e4b590b481d6e4b980c1360a246f43a0343f1","version":"1.0.0"},"settingsDigest":"sha256:e4a9ccba950218de669ddbf657479be7f173cd1806fddf8df434b1c4b402ed7c","sourceArtifacts":[{"coordinate":"fixture:semantic-source@1","digest":"sha256:90b878cbd69d5eb0c1673e4ed9652da70d97ff0a6ffbe689a4ec82241a5927ac"}]}
